1815LX1-23LED-120-30K,1815LX1-23LED-120-30K,23W LED White Housing Clear Prismatic Polycarbonate Lens Utility Light 3000K,Incon Lighting,"<h2 class=""short_description"">125 Watt Equivalent Soft White - Damp Location Ceiling or Wall Mount Outdoor Light Fixture - Made in the USA</h2> <div class=""description""> <p>Incon Lighting's 181 series is an outdoor ceiling or wall mount light fixture that is UL damp location listed, making it ideal for just about any application at your business or residential. The 1819LX1-23LED-120 includes a 23 watt (125W equivalent) LED unit that emits 1850 lumens of soft white light, and it is made in the USA. It has an impact resistant white powdercoated aluminum pan housing with a clear prismatic polycarbonate lens.</p> </div> <h4>Downloads</h4> <div class=""collateral-box attachment-specs""> <ul id=""product-attachment-specs-table"" class=""data-table""> <li><span class=""label""> <a class=""prod-attach"" title=""181 LED Series"" href=""https://lightbulbsurplus.com/content/file-1506536803.pdf""> <span class=""attach-img""><img style=""margin-right: 5px;"" src=""https://cdn11.bigcommerce.com/s-o7p3kkw0ib/product_images/uploaded_images/pdf.png"" alt=""View File"" /></span> </a> </span> <p>181 Series Specifications</p> </li> </ul> </div>",Fixtures/Indoor/Flush Mount,,https://lightbulbsurplus.com/products/23w-led-white-housing-clear-prismatic-polycarbonate-lens-utility-light-3000k.html,,"""Fixture Style=Economy"";""Shade/Lens Color=Clear Prismatic"";""Shade/Lens Material=Polycarbonate"";""Base Color=White"";""Depth (in.)=4.125"";""Width (in.)=10.75"";""Height (in.)=10.75"";""Case Quantity=1"";""Color Temperature=3000K"";""Country of Origin=Made in the USA"";Dimmable=Yes;""Lumens=1850 Lumens"";""Order Code=1819LX1-23LED-120-30K"";""Equivalent=125 Watts"";""UL Listed=Damp Location Listed"";Voltage=120V;""Wattage=23 Watts"";""Bulb Color=Soft White"";""Light Source=LED""",0,39676
60227-WH-XX,60227-WH-XX,Replacement White 27 Inch Globe Acrylic Post Light Cover,Incon Lighting,"<h2 class=""short_description"">27"" Plastic Lighting Sphere Pole Fixture Lens Ball Diffuser Custom Neckless Opening</h2> <div class=""description""> <p>*Note: This white 27 inch neckless two-piece globe has a minimum hole 5.25"" opening and ships directly from the Brand. These are shipped via truck-line because of their size and require additional freight charges. Because this is a custom cut, this item is <strong>NOT RETURNABLE</strong>.</p> <p><strong>WARNING:</strong></p> <p>This product is intended for use in lighting applications only.</p> <p>Abuse or misuse of this product can result in injury.</p> <p>Please keep this product out of the reach of children.</p> </div>",Parts & Components/Globes;Parts & Components/Globes/White Light Globes,720043485786,https://lightbulbsurplus.com/products/replacement-white-27-inch-globe-acrylic-post-light-cover.html,,"""Shade/Lens Color=White"";""Custom Maximum Opening (in)=17.00"";""Custom Minimum Opening (in)=5.25"";""Diameter (in.)=27 Inch"";""Inner Opening (in)=Custom (Please note on check out page)"";""Globe Size=27 Inch"";Base=Neckless;""Case Quantity=1"";""Catalog No=48578"";Color=White;""Country of Origin=Made in USA"";""Order Code=60227-WH-XX"";""Short Description=Ships in 4 to 6 weeks""",0,39700
32265-LED,32265-LED,Plastic Outdoor LED Bulkhead Nautical Light Fixture Cross Bar Frame,Incon Lighting,"<h2 class=""short_description"">Round Design - 75 Watt Equivalent - Wet Location - Wall And Ceiling Mount - Exterior Marine Type Light Fixture - Integrated LED</h2> <div class=""description""> <p>Incon Lighting's 322 series is a marine-style wet location outdoor wall and ceiling mount bulkhead light fixture that is UL wet location listed, making it ideal for exterior use at your home or business. It has a commercial grade black polycarbonate grid frame with a UV stabilized frosted polycarbonate lens, and is made in the USA.</p> <h4><span>Features</span></h4> <ul> <li>Black or White Composite Finish</li> <li>White Powder-Coated Aluminum Pan (LED Models)</li> <li>Frosted Reduced Glare Polycarbonate Lens</li> <li>Composite Cross Grid Frame</li> <li>Mounting Hardware Included</li> <li>Wall or Ceiling Mount</li> <li>Minimum Starting Temp -20&ordm;F</li> <li>UL Listed for Wet Locations&nbsp;</li> <li>5 Year Warranty LED</li> <li>Dimmable</li> <li>Energy Star Listed&nbsp;(All Integrated LED Models)</li> <li>Made in the USA Compliant</li> </ul> <h4><span>Integrated LED 120V System (80CRI)</span></h4> <ul> <li><strong>13W Integrated LED</strong></li> <ul> <li>3000K - 1,140lm (75W Equal)</li> <li>4000K - 1,280lm (75W Equal)</li> </ul> </ul> </div> <h4>Downloads</h4> <div class=""collateral-box attachment-specs""><span class=""label""><span class=""attach-img""><a href=""https://inconlighting.com/content/specs/322.pdf"" target=""_blank""><img class=""__mce_add_custom__"" style=""margin-right: 5px;"" title=""lbs-download-spec-100px.png"" src=""https://cdn11.bigcommerce.com/s-o7p3kkw0ib/product_images/uploaded_images/lbs-download-spec-100px.png"" alt=""lbs-download-spec-100px.png"" width=""100"" height=""100"" /></a></span></span></div> <div class=""collateral-box attachment-specs""> <h4>Disclaimers</h4> <p><em>*This product typically ships in 5 to 7 business days. Larger quantities may take longer than stated lead-time.&nbsp; All lead-times are estimates and you will be notified by email if it will take longer than 7 business days to ship. This item ships directly from the factory.</em></p> </div> <div class=""collateral-box attachment-specs"">&nbsp;</div> <div class=""collateral-box attachment-specs"">&nbsp;</div> <script type=""text/javascript"" src=""chrome-extension://fpjppnhnpnknbenelmbnidjbolhandnf/content_script_web_accessible/ecp_regular.js""></script> <script type=""text/javascript"" src=""chrome-extension://fpjppnhnpnknbenelmbnidjbolhandnf/content_script_web_accessible/ecp_regular.js""></script>",Fixtures/Outdoor/Wall Mount,,https://lightbulbsurplus.com/plastic-outdoor-led-bulkhead-nautical-light-fixture-cross-bar-frame/,https://inconlighting.com/content/specs/322.pdf,"""Fixture Style=Nautical"";""Shade/Lens Color=Frosted"";""Shade/Lens Material=Polycarbonate"";""Base Color=Black or White"";""Depth (in.)=5.375"";""Diameter (in.)=10.375"";""Case Quantity=1"";""Country of Origin=Made in the USA"";Dimmable=Yes;""Equivalent=75 Watts"";""UL Listed=Wet Location Listed"";Voltage=120V;""Wattage=13 Watts"";""Light Source=LED"";""Lighting Technology=Integrated LED"";""Color Temperature=Choose Your CCT (Variants)"";""__Lumen Range=1000-1499"";""__Wattage Range=10-19"";""__Fixture Finish=White"";""__Fixture Finish=Black""",0,39993
LENS-21611,LENS-21611,Incon Lighting LENS-21611,Incon Lighting,"<p>Crafted with high-quality materials, the Incon Lighting LENS-21611 is a replacement white acrylic wall sconce lens that is designed to bring a fresh and elegant touch to your lighting fixtures. Manufactured in the USA with utmost precision and attention to detail, this lens is the perfect choice for those looking to enhance the aesthetics of their interior spaces.<br /><br />The LENS-21611 is crafted from durable white acrylic, ensuring its longevity and ability to withstand daily wear and tear. Its sturdy construction guarantees an extended lifespan, so you can enjoy its beauty and functionality for years to come. The white molded frame adds a touch of sophistication and complements any style of decor, making it a versatile choice for both residential and commercial settings.<br /><br />Whether you want to replace a damaged lens or simply refresh the appearance of your existing wall sconce, the LENS-21611 is an excellent choice. Its sleek and timeless design ensures it can effortlessly blend in with any decor theme, while adding a touch of modern elegance to your space. The white color of the lens and frame creates a harmonious and calming atmosphere, making it suitable for various rooms such as living rooms, bedrooms, hallways, and offices.<br /><br />Easy to install, the LENS-21611 provides a hassle-free replacement solution that does not require professional assistance. It seamlessly fits into standard wall sconce fixtures, allowing for a quick and effortless upgrade. Simply remove the old lens and frame, and replace them with the LENS-21611 to instantly transform the look of your lighting fixture. Please note that the fixture itself is not included, making this product an ideal replacement lens for your existing wall sconce.<br /><br />Enhance your lighting fixtures with the elegance and durability of the Incon Lighting LENS-21611. Engineered with superior craftsmanship and made from high-quality materials, this replacement white acrylic wall sconce lens with a white molded frame is a reliable choice that is sure to meet your aesthetic and functional needs. Upgrade your space today with this exquisite lens, and enjoy a renewed and captivating ambiance in your home or office.</p>",Fixtures/Indoor/Wall Sconces,,https://lightbulbsurplus.com/products/incon-lighting-lens-21611.html,,"""Shade/Lens Color=White Translucent"";""Shade/Lens Material=Acrylic"";""Depth (in.)=4.00"";""Width (in.)=11.50"";""Height (in.)=10.30"";""Case Quantity=1"";""Country of Origin=Made in the USA"";""Order Code=LENS-2161""",0,40041
38911-22LED-120-40K,38911-22LED-120-40K,Round White Eyelid IP65 23W LED 4000K Wall or Ceiling Light,Incon Lighting,"<h2 class=""short_description"">Aluminum Frame and Eyelid - 125 Watt Equivalent Cool White - Energy Star Listed - Wet Location Dual Mount</h2> <div class=""description""> <p>Incon Lighting's 389 series is a decorative overhead or wall mount light fixture that is wet location listed and IP65 rated, making it ideal for use at your home or business. It has a powdercoated white cast aluminum frame and eyelid with a white UV stabilized acrylic lens, and is made in the USA. The 38911-23LED-120 includes a 23 watt (125W equivalent) LED unit that emits 1850 lumens of cool white light.</p> </div>",Fixtures/Outdoor/Wall Mount,,https://lightbulbsurplus.com/round-white-eyelid-ip65-23w-led-4000k-wall-or-ceiling-light/,,"""Fixture Style=Modern"";""__Lumen Range=1500-1999"";""__Fixture Finish=White"";""Lighting Technology=Integrated LED"";""__Wattage Range=20-29"";""Shade/Lens Color=White"";""Shade/Lens Material=Acrylic"";""Base Color=White"";""Depth (in.)=3.01"";""Diameter (in.)=11.8"";""Case Quantity=1"";""Color Temperature=4000K"";""Country of Origin=Made in the USA"";Dimmable=Yes;""Energy Star=Yes"";""Lumens=1850 Lumens"";""Order Code=38911-23LED-120-EY-40K"";""Equivalent=125 Watts"";""UL Listed=Wet Location Listed"";Voltage=120V;""Wattage=23 Watts"";""Bulb Color=Cool White"";""Light Source=LED"";""IP65 Rated=Yes""",0,40043
33561-13LED-120-30K,33561-13LED-120-30K,13W LED Nautical White Grid Security Fixture 3000K,Incon Lighting,"<h2 class=""short_description"">60 Watt Equivalent Soft White - Wet Location UL Listed - Wall Mount Impact Resistant Exterior Light Fixture</h2> <div class=""description""> <p>Incon Lighting's 335 series is an outdoor wall mount fixture that is UL wet location listed, making it ideal for exterior use at your home or business. It has a impact resistant white polycarbonate grid frame with a UV stabilized frosted polycarbonate lens, and is made in the USA. The ADA-compliant 33561-13LED-120 includes a 13 watt (60W equivalent) LED bulb that emits 900 lumens of soft white light.</p> <p>A dusk-to-dawn photocell is also available at a small additional cost.</p> </div> <h4>Downloads</h4> <div class=""collateral-box attachment-specs""> <ul id=""product-attachment-specs-table"" class=""data-table""> <li><span class=""label""> <a class=""prod-attach"" title=""335 LED Series"" href=""https://lightbulbsurplus.com/content/file-1503182884.pdf""> <span class=""attach-img""><img style=""margin-right: 5px;"" src=""https://cdn11.bigcommerce.com/s-o7p3kkw0ib/product_images/uploaded_images/pdf.png"" alt=""View File"" /></span> </a> </span> <p>335 Series Specifications</p> </li> </ul> </div>",Fixtures/Outdoor/Wall Mount,,https://lightbulbsurplus.com/products/13w-led-nautical-white-grid-security-fixture-3000k.html,,"""Fixture Style=Nautical"";""Shade/Lens Color=Frosted"";""Shade/Lens Material=Polycarbonate"";""Base Color=White"";""Depth (in.)=4.50"";""Width (in.)=6.00"";""Height (in.)=10.625"";""Case Quantity=1"";""Color Temperature=3000K"";""Country of Origin=Made in the USA"";""Energy Star=Yes"";""Lumens=900 Lumens"";""Order Code=33561-13LED-120-30K"";""Equivalent=60 Watts"";""UL Listed=Wet Location Listed"";Voltage=120V;""Wattage=13 Watts"";""Bulb Color=Soft White"";""Light Source=LED"";""Lighting Technology=Bulbs Included"";""__Lumen Range=500-999"";""__Wattage Range=10-19"";""__Fixture Finish=White""",0,40239
LENS-1141,LENS-1141,"14"" White Drum Light Shade Cover Replacement",Incon Lighting,"<h2 class=""short_description""><strong>&nbsp;14 inch&nbsp;<span id=""productTitle"" class=""a-size-large product-title-word-break"">Circline&nbsp;</span>White Acrylic Plastic Round Diffuser | 1<span id=""productTitle"" class=""a-size-large product-title-word-break"">2.625""OD Fitter Neck, 2.75""H</span></strong></h2> <div class=""description""> <p><em><strong>Replacement 14"" White Drum Light Cover: A Perfect Blend of Style and Functionality</strong></em></p> <p>Introduce a fresh look to your lighting fixtures with our Replacement 14"" White Drum Light Cover, designed to seamlessly fit a range of lighting products. This white acrylic lens is not just a component; it's an upgrade to your interior's ambiance and lighting quality.</p> </div> <h4><strong>Key Features:</strong></h4> <ul> <li><span>Universal Compatibility:</span> Specifically designed to fit models from Brownlee (2050-14 Series), Incon (11411 &amp; 114-1-1 Series), Seagull (14"" Haylee), Teron Lighting (14"" Eagle), and Progress Lighting (P7378-30).</li> <li><span>Premium Material:</span> Crafted from high-quality white acrylic, this drum diffuser ensures even light distribution and adds a modern touch to your space.</li> <li><span>Easy Installation:</span> The lens is designed to be securely held in place with 3 set screws, making the installation process straightforward and hassle-free.</li> <li><span>Versatile Design:</span> With its classic white finish and clean lines, this drum light cover complements a wide range of interior designs, from contemporary to traditional.</li> <li><span>Durable and Long-Lasting:</span> Acrylic material offers excellent durability and resistance to impact, ensuring your light cover remains pristine over time.</li> </ul> <p>Whether you're looking to replace a worn-out drum cover or simply want to refresh the look of your lighting fixture, our Replacement 14"" White Drum Light Cover is the perfect choice. It not only enhances the aesthetic appeal of your lighting but also ensures optimal light diffusion, creating a warm and inviting atmosphere in your space.</p> <h4><strong>Compatibility Models:</strong></h4> <ul> <li>Brownlee: 2050-14 Series</li> <li>Incon: 11411 Series, 114-1-1 Series</li> <li>KastLite 14"" Circline Acrylic Drum Lens</li> <li>Seagull: 14"" Haylee</li> <li>Teron Lighting: 14"" Eagle</li> <li>Progress Lighting: P7378-30</li> </ul> <p>Upgrade your lighting today with our Replacement 14"" White Drum Light Cover and experience the perfect combination of style, functionality, and quality. Elevate your interior with this simple yet impactful lighting solution.</p> <h4><strong>Maintenance and Helpful Cleaning Tips:</strong></h4> <ul> <li><span>Dust Regularly:</span> Gently wipe with a soft, dry cloth to remove surface dust.</li> <li><span>Clean Carefully:</span> Use a mild soap and water solution with a soft cloth for deeper cleaning. Avoid harsh chemicals.</li> <li><span>Rinse Well:</span> Ensure all soap is removed by wiping with a clean, damp cloth.</li> <li><span>Dry Thoroughly:</span> Pat dry with a soft, dry cloth to prevent water spots.</li> <li><span>Inspect Regularly:</span> Check for and promptly address any signs of damage to maintain the cover's integrity.</li> </ul> <div class=""description""> <h4><strong>Downloads</strong></h4> <p><a title=""Replacement Drum Diffuser Cover Lens"" href=""https://lightbulbsurplus.com/content/11-Series.pdf"" target=""_blank""><img class=""__mce_add_custom__"" title=""lbs-download-spec-100px.png"" src=""https://cdn11.bigcommerce.com/s-o7p3kkw0ib/product_images/uploaded_images/lbs-download-spec-100px.png"" alt=""lbs-download-spec-100px.png"" width=""100"" height=""100"" /></a></p> <h4><strong>Disclaimers</strong></h4> <p><em>*This product typically ships in 1 to 2 business day. Larger quantities may take longer than stated lead-time.&nbsp; All lead-times are estimates and you will be notified by email if it will take longer than 5 business days to ship. <strong>NOTE:</strong>&nbsp; Not for Ceiling Fans</em></p> <p>&nbsp;</p> </div>",Fixtures/Indoor/Flush Mount;Fixtures/Lighting Fixture Parts,720043486110,https://lightbulbsurplus.com/14-white-drum-light-shade-cover-replacement/,https://lightbulbsurplus.com/content/11-Series.pdf,"""Order Code=LENS-1141"";""Fixture Finish=White"";""Shade/Lens Material=Acrylic"";""Depth (in.)=3.00"";""Width (in.)=13.75"";""Neck Exterior (in)=12.6875"";""Catalog No=2050 Replacement Lens"";""Country of Origin=Made in the USA"";""Price Shown=Per Cover""",0,40470
13251-INC-NL,13251-INC-NL,60W Max Clear Prismatic Globe Ceiling Mount White Entrance Light,Incon Lighting,"<h2 class=""short_description"">60 Watt - Impact Resistant Polycarbonate Light Housing - Wet Location Ceiling Mount</h2> <div class=""description""> <p>Incon Lighting's 130 series are economy style outdoor fixtures for wet locations, ideal for residential, commercial, and industrial use. The 13291-INC does not include a bulb; it has a 60 watt maximum E26 socket. It has a clear prismatic UV stabilized acrylic globe lens and a white impact resistant polycarbonate housing. There is also an optional pullchain or photocell for dusk-to-dawn operation.</p> </div> <h4>Downloads</h4> <div class=""collateral-box attachment-specs""> <ul id=""product-attachment-specs-table"" class=""data-table""> <li><span class=""label""> <a class=""prod-attach"" title=""130/132 LED Series"" href=""https://lightbulbsurplus.com/content/file-1510086415.pdf""> <span class=""attach-img""><img style=""margin-right: 5px;"" src=""https://cdn11.bigcommerce.com/s-o7p3kkw0ib/product_images/uploaded_images/pdf.png"" alt=""View File"" /></span> </a> </span> <p>130/132 Series Specifications</p> </li> </ul> </div>",Fixtures/Outdoor/Wall Mount,,https://lightbulbsurplus.com/60w-max-clear-prismatic-globe-ceiling-mount-white-entrance-light/,,"""Fixture Style=Economy"";""Shade/Lens Color=Clear Prismatic"";""Shade/Lens Material=Acrylic"";""Base Color=White"";""Height (in.)=7.50"";""Diameter (in.)=6.00"";""Case Quantity=1"";""Country of Origin=Made in the USA"";""Order Code=13291-INC-NL"";""Socket Type=E26"";""UL Listed=Wet Location Listed"";Voltage=120V;""Wattage=60 Watts"";""Light Source=Incandescent"";""Lighting Technology=LED Ready"";""__Fixture Finish=White""",0,40499
81815-E26,81815-E26,"60W Max Black Post Top 18"" White Globe Fixture",Incon Lighting,"<h2 class=""short_description"">Incon Lighting 81815-INC-NL Wet Location Listed Outdoor Round Style Pole Mount Light</h2> <div class=""description""> <p>The Incon 81815-INC-NL has a medium E26 socket which holds a 60W bulb (or CFL/LED equivalent; lamp not included). It comes with an iron-clad 5 year warranty. Please contact one of our lighting experts if you have any questions.</p> </div>",Fixtures/Outdoor/Street Lights | Post Mount/Round Globe Post Top,,https://lightbulbsurplus.com/60w-max-black-post-top-18-white-globe-fixture/,,"""Fixture Style=Traditional"";""Shade/Lens Color=White"";""Shade/Lens Material=Acrylic"";""Base Color=Black"";""Height (in.)=18.25"";""Diameter (in.)=18"";""Case Quantity=1"";""Country of Origin=Made in the USA"";""Order Code=81815-E26"";""Socket Type=Medium (E26)"";""UL Listed=Wet""",0,40588
FRAME-33261,FRAME-33261,Incon FRAME-33261,Incon Lighting,"<p>The Incon FRAME-33261 is a replacement white polypropylene plastic hood roof part for the Incon Lighting 332 Series wall fixture. Crafted with high-quality impact resistant polypropylene, this lens is designed to provide durability and longevity, ensuring that it withstands the elements and everyday wear and tear.<br /><br />This replacement part perfectly fits the Incon Lighting 332 Series wall fixture, offering a seamless and effortless installation process. Its precise measurements and design ensure a snug fit, allowing for easy replacement without the need for modifications or adjustments.<br /><br />The white polypropylene material of this hood roof part adds a sleek and modern aesthetic to your lighting fixture. Its clean and minimalist look effortlessly blends with any decor style, making it an ideal choice for various settings, including residential and commercial applications.<br /><br />Not only does the Incon FRAME-33261 provide an attractive appearance, but it also enhances the functionality of your lighting fixture. The impact resistant polypropylene construction ensures that your fixture stays protected against accidental bumps or knocks. It offers superior resistance to outdoor elements, including harsh weather conditions, UV rays, and moisture, allowing for reliable performance and extended lifespan.<br /><br />For your convenience, this replacement part is available for download. The included specification sheet provides detailed information about the product, allowing you to make an informed purchasing decision. With easy access to the specifications, you can ensure that this replacement part precisely matches your existing fixture, guaranteeing a seamless integration and hassle-free installation.<br /><br />Upgrade and enhance your Incon Lighting 332 Series wall fixture with the Incon FRAME-33261 replacement white polypropylene plastic hood roof part. With its durable construction, aesthetic appeal, and easy installation process, this product is a must-have for anyone looking to maintain the functionality and visual appeal of their lighting fixtures.</p>",Fixtures/Lighting Fixture Parts,720043486097,https://lightbulbsurplus.com/incon-frame-33261/,,"""Order Code=FRAME-33261""",0,40845
11111-LED,11111-LED,White Drum Flush Mount LED Light Fixture,Incon Lighting,"<h2 class=""short_description"">11"" Minimalist Classic Ceiling&nbsp;Luminaire - Energy Star - Dimmable</h2> <p class=""short_description"">Simple yet versatile, this economical utility 11"" ceiling flush mount features a smooth white acrylic diffuser that is both durable and highly transmissive for maximum light output.&nbsp; See specifications below for lumen output of each model.</p> <div class=""description""> <h4><strong>Features</strong></h4> <ul> <li>White Acrylic Lens</li> <li>White Aluminum Pan for Optimal Heat&nbsp;Dissipation</li> <li>Warm White 3000K or Cool White 4000K Illumination</li> <li>UL - Damp Location Listed</li> <li>ADA compliant, low profile design</li> <li>Energy Star Qualified</li> <li>Buy American Complaint</li> <li>Mounted on Ceiling or Wall</li> <li>Dimmable (with approved dimmers)</li> <li>11"" (Diameter) x 3"" (Depth)</li> </ul> <h4><strong>Downloads</strong></h4> <p><a href=""https://inconlighting.com/content/specs/111.pdf"" target=""_blank""><img class=""__mce_add_custom__"" title=""pdf-specs.png"" src=""https://cdn11.bigcommerce.com/s-o7p3kkw0ib/product_images/uploaded_images/pdf-specs.png"" alt=""pdf-specs.png"" width=""100"" height=""125"" /></a></p> <h4><strong>Disclaimers</strong></h4> <p><em>*This product typically ships in 2 to 3 business days. Larger quantities may take longer than stated lead-time.&nbsp; All lead-times are estimates and you will be notified by email if it will take longer than 4 business days to ship.</em></p> </div>",Fixtures/Indoor/Flush Mount,,https://lightbulbsurplus.com/white-drum-flush-mount-led-light-fixture/,https://inconlighting.com/content/specs/111.pdf,"""Shade/Lens Material=Acrylic"";""Shade/Lens Color=White"";""Diameter (in.)=11"";""Depth (in.)=3"";""UL Listed=Damp Location Listed"";""Warranty=5 years"";""Country of Origin=Made in the USA""",0,40930
