81615-E26,81615-E26,"16"" White Globe Post Top Light - Black Base - Fits 3"" Pole - E26 Medium Socket",Incon Lighting,"<h2 class=""short_description""><strong>16"" Inch Outdoor Pole or Pier Mount Globe Light &ndash; Wet Rated and LED Ready &ndash; Fits 3"" Diameter Posts</strong></h2> <p data-start=""315"" data-end=""698"">The 16"" White Globe Post Top Light is a classic outdoor fixture designed to deliver bright, even illumination for residential and commercial spaces. Built with a durable black composite wing-clamp base and a UV-resistant white acrylic globe, this fixture mounts securely to any standard 3-inch diameter post or to a pier-mount base for flat-surface installations.&nbsp;&nbsp;Perfect for yards, driveways, walkways, HOA communities, parks, and commercial pathways, this globe light is UL Listed for Wet Locations and ready for LED or incandescent lamps with its E26 medium-base socket (150W max).</p> <h4 data-start=""935"" data-end=""954""><strong data-start=""938"" data-end=""954"">Key Features</strong></h4> <ul data-start=""955"" data-end=""1774""> <li data-start=""955"" data-end=""1079""> <p data-start=""957"" data-end=""1079""><strong data-start=""957"" data-end=""984"">16"" White Acrylic Globe</strong><br data-start=""984"" data-end=""987"" /> UV-resistant, high-quality acrylic globe with a 5.25"" opening for optimal light diffusion.</p> </li> <li data-start=""1081"" data-end=""1206""> <p data-start=""1083"" data-end=""1206""><strong data-start=""1083"" data-end=""1127"">Black Corrosion-Resistant Composite Base</strong><br data-start=""1127"" data-end=""1130"" /> Durable polycarbonate wing-clamp design keeps the globe securely attached.</p> </li> <li data-start=""1208"" data-end=""1306""> <p data-start=""1210"" data-end=""1306""><strong data-start=""1210"" data-end=""1239"">Fits Standard 3"" OD Posts</strong><br data-start=""1239"" data-end=""1242"" /> Designed for direct mount on 3-inch poles (post not included).</p> </li> <li data-start=""1308"" data-end=""1416""> <p data-start=""1310"" data-end=""1416""><strong data-start=""1310"" data-end=""1335"">Pier Mount Compatible</strong><br data-start=""1335"" data-end=""1338"" /> Works with pier-mount bases for deck, column, or flat-surface installations.</p> </li> <li data-start=""1418"" data-end=""1532""> <p data-start=""1420"" data-end=""1532""><strong data-start=""1420"" data-end=""1448"">LED &amp; Incandescent Ready</strong><br data-start=""1448"" data-end=""1451"" /> E26 medium-base socket supports 150W max incandescent or any screw-in LED bulb.</p> </li> <li data-start=""1534"" data-end=""1634""> <p data-start=""1536"" data-end=""1634""><strong data-start=""1536"" data-end=""1561"">UL Wet Location Rated</strong><br data-start=""1561"" data-end=""1564"" /> Safe and reliable in rain, snow, humidity, and outdoor environments.</p> </li> <li data-start=""1636"" data-end=""1706""> <p data-start=""1638"" data-end=""1706""><strong data-start=""1638"" data-end=""1657"">Made in the USA</strong><br data-start=""1657"" data-end=""1660"" /> Built with durable, high-quality components.</p> </li> <li data-start=""1708"" data-end=""1774""> <p data-start=""1710"" data-end=""1774""><strong data-start=""1710"" data-end=""1728"">Quick Shipping</strong><br data-start=""1728"" data-end=""1731"" /> Typically ships in <strong data-start=""1752"" data-end=""1773"">1&ndash;2 business days</strong>.</p> </li> </ul> <h4 data-start=""1781"" data-end=""1796""><strong data-start=""1784"" data-end=""1796"">Benefits</strong></h4> <ul> <li>Classic globe appearance enhances any outdoor landscape or architectural style</li> <li>Even, wide-area illumination ideal for safety and visibility</li> <li>Durable materials resist fading, cracking, and corrosion</li> <li>Easy to install on any standard post or pier mount</li> <li>LED-ready design allows you to add energy efficiency instantly</li> </ul> <h4 data-start=""2134"" data-end=""2150""><strong data-start=""2137"" data-end=""2150"">Ideal For</strong></h4> <ul> <li>Residential front yards &amp; driveways</li> <li>HOA communities &amp; neighborhood pathways</li> <li>Commercial buildings &amp; parking areas</li> <li>Parks, walkways, and campuses</li> <li>Outdoor decks, piers, and column mounts (with pier base)</li> </ul> <h4 data-start=""2377"" data-end=""2398""><strong data-start=""2380"" data-end=""2398"">Specifications</strong></h4> <ul> <li><strong data-start=""2401"" data-end=""2418"">Fixture Type:</strong> Outdoor Post Globe Light</li> <li><strong data-start=""2448"" data-end=""2467"">Globe Diameter:</strong> 16""</li> <li><strong data-start=""2476"" data-end=""2495"">Globe Material:</strong> White acrylic</li> <li><strong data-start=""2514"" data-end=""2532"">Base Material:</strong> Black composite polycarbonate</li> <li><strong data-start=""2567"" data-end=""2580"">Mounting:</strong> Fits 3"" OD post or pier base</li> <li><strong data-start=""2614"" data-end=""2625"">Socket:</strong> E26 Medium Base (150W Max)</li> <li><strong data-start=""2657"" data-end=""2666"">Bulb:</strong> LED or incandescent (not included)</li> <li><strong data-start=""2706"" data-end=""2723"">Overall Size:</strong> 16.25"" H &times; 16"" W</li> <li><strong data-start=""2745"" data-end=""2762"">Opening Size:</strong> 5.25""</li> <li><strong data-start=""2773"" data-end=""2793"">Location Rating:</strong> UL Listed for Wet Locations</li> <li><strong data-start=""2826"" data-end=""2841"">Compliance:</strong> Buy American Compliant</li> <li><strong data-start=""2869"" data-end=""2881"">Made in:</strong> USA</li> </ul> <div class=""description""> <h4><strong>Downloads</strong></h4> <p><em><a title=""Globe Post Top Specifications"" href=""https://inconlighting.com/content/specs/816.pdf"" target=""_blank""><img class=""__mce_add_custom__"" title=""lbs-download-spec-100px.png"" src=""https://cdn11.bigcommerce.com/s-o7p3kkw0ib/product_images/uploaded_images/lbs-download-spec-100px.png"" alt=""lbs-download-spec-100px.png"" width=""100"" height=""100"" /></a></em><a href=""https://inconlighting.com/content/specs/800-instruction.pdf"" target=""_blank""><img class=""__mce_add_custom__"" title=""lbs-download-install-100px.png"" src=""https://cdn11.bigcommerce.com/s-o7p3kkw0ib/product_images/uploaded_images/lbs-download-install-100px.png"" alt=""lbs-download-install-100px.png"" width=""100"" height=""100"" /></a></p> <h4><strong>Disclaimers</strong></h4> <p><em>*This product typically ships in 1 to 2 business days. Larger quantities may take longer than stated lead-time.&nbsp; All lead-times are estimates and you will be notified by email if it will take longer than 5 business days to ship.</em></p> </div>",Fixtures/Outdoor/Street Lights | Post Mount/Round Globe Post Top,,https://lightbulbsurplus.com/16-white-globe-post-top-light-black-base-fits-3-pole-e26-medium-socket/,https://inconlighting.com/content/specs/800-instruction.pdf,"""Order Code=81615-E26"";""Fixture Style=Traditional"";""Shade/Lens Color=White"";""Shade/Lens Material=Acrylic"";""Base Color=Black"";""Height (in.)=16.25"";""Diameter (in.)=16"";""Country of Origin=Made in the USA"";""Socket Type=E26 Medium"";""UL Listed=Wet Location"";""Case Quantity=1""",0,47359
81415-E26,81415-E26,"14"" White Globe Lamp Post Light Fixture with Medium Socket",Incon Lighting,"<h2 class=""short_description"">Outdoor&nbsp;Pole or Pier Mount Top Fixture | Black Polycarbonate Base | Wet Location</h2> <div class=""description""> <p><span>Elevate your outdoor space with this stylish white globe lamp post light. This classic design comes complete with a UV resistant 14"" white acrylic globe and black non-corrosive composite wing-clamp fitter that fits standard 3"" OD poles or pier mounts (not included). UL listed for safe use in wet locations, this lamp post light is an ideal yet attractive way to provide illumination outwardly. Enjoy the assurance of a 3 year warranty when you choose this lantern fixture.&nbsp;</span></p> <h4><strong>Features</strong></h4> <ul> <li>White UV Resistant Acrylic Smooth Globe</li> <li>Black Non-Corrosive Composite Wing-Clamp Fitter</li> <li>Incandescent, CFL, or LED Ready.&nbsp;<em>(not included)</em></li> <li>Fits Standard 3"" OD Pole or Pier Mounts&nbsp;<em>(not included)</em></li> <li>UL for Wet Locations</li> <li>Buy American&nbsp;Compliant (BAA)</li> <li>3 Year Warranty</li> <li>Standard Pack Qty: 1</li> </ul> <strong>Medium E26 Socket Base&nbsp;</strong><br /> <ul> <ul> <ul> <li>Incandescent<em> (150W Max)&nbsp;(Bulb Not Included)</em>&nbsp;</li> <li>LED Ready E26 Screw-In <em>(Bulb Not Included)</em></li> </ul> </ul> </ul> <h4><strong style=""font-size: 1em;"">Downloads</strong></h4> <p><a href=""https://inconlighting.com/content/specs/814.pdf"" rel=""nofollow"" target=""_blank""><img class=""__mce_add_custom__"" title=""lbs-download-spec-100px.png"" src=""https://cdn11.bigcommerce.com/s-o7p3kkw0ib/product_images/uploaded_images/lbs-download-spec-100px.png"" alt=""lbs-download-spec-100px.png"" width=""100"" height=""100"" /></a><a href=""https://inconlighting.com/content/specs/800-instruction.pdf"" rel=""nofollow"" target=""_blank""><img class=""__mce_add_custom__"" title=""lbs-download-install-100px.png"" src=""https://cdn11.bigcommerce.com/s-o7p3kkw0ib/product_images/uploaded_images/lbs-download-install-100px.png"" alt=""lbs-download-install-100px.png"" width=""100"" height=""100"" /></a></p> <h4><strong>Disclaimers</strong></h4> <p><em>*This product typically ships in 2 to 3 business days. Larger quantities may take longer than stated lead-time.&nbsp; All lead-times are estimates and you will be notified by email if it will take longer than 5 business days to ship.</em></p> <p>&nbsp;</p> </div>",Fixtures/Outdoor/Street Lights | Post Mount/Round Globe Post Top,,https://lightbulbsurplus.com/14-white-globe-lamp-post-light-fixture-with-medium-socket/,https://inconlighting.com/content/specs/814.pdf,"""Order Code=81415-E26"";""Fixture Style=Traditional"";""Fixture Type=Post Top"";""Fixture Shape=Globe"";""Fixture Environment=Outdoor"";""Fixture Application=Area, General"";""Shade/Lens Color=White"";""Base Color=Black"";""Light Source=Incandescent or LED Ready (Bulb Not Included)"";""Shade/Lens Material=Acrylic"";""Socket Type=E26 Medium"";""Height (in.)=14.25"";""Diameter (in.)=14.00"";""Case Quantity=1"";""Safety Rating=UL Listed for Wet Locations"";""Country of Origin=Made in the USA"";""Warranty=3 Year"";""Price Shown=Per Fixture"";""Short Description=Typically Ships in 2-3 Business Days*""",0,47417
21617-LED,21617-LED,Ultra Chrome Hallway ADA Compliant Modern LED Wall Sconce,Incon Lighting,"<p class=""short_description"">The Ultra Chrome wall sconce is a complete, versatile option given the array of applications it can be used in. Subtle, neutral design with clean trim lines. The top and bottom of the fixture is covered with translucent white acrylic to allow for subtle wall wash. Use this damp location wall sconce on your next hotel or multifamily retrofit. This wall mount fixture and can be made with a&nbsp;<a href=""https://lightbulbsurplus.com/incon-21617-b3"" target=""_blank"">battery back up ballast</a>.&nbsp; Other colors available.</p> <h4><strong>Features</strong></h4> <ul> <li>White UV Stabilized Acrylic Cover with Ultra Chrome Accents</li> <li>White Aluminum Back Pan</li> <li>Composite Decorative Frame</li> <li>ADA Compliant</li> <li>Closed Top/Bottom Design</li> <li>Buy American Act Compliant</li> <li>Dimmable</li> <li>UL for Damp Locations</li> <li>Replaceable LED Bulb (Medium Base)</li> </ul> <h4 class=""short_description"">Wattage</h4> <ul> <li>2 x 9 Watt 1,600 Lumens (120W Equal)</li> <li>Other Wattage(s) available upon request</li> </ul> <h4 class=""short_description"">Downloads</h4> <p class=""short_description""><span class=""attach-img""><a class=""prod-attach"" title=""216 LED Series"" href=""https://inconlighting.com/content/specs/216.pdf"" target=""_blank""><img class=""__mce_add_custom__"" title=""lbs-download-spec-100px.png"" src=""https://cdn11.bigcommerce.com/s-o7p3kkw0ib/product_images/uploaded_images/lbs-download-spec-100px.png"" alt=""lbs-download-spec-100px.png"" width=""100"" height=""100"" /></a></span></p> <h4><strong>Disclaimers</strong></h4> <p><em>This product is built to order typically ships in 3 to 5 business days. Larger quantities may take longer than stated lead-time.&nbsp; All lead-times are estimates and you will be notified by email if it will take longer than 5 business days to ship.</em></p> <p>&nbsp;</p>",Fixtures/Indoor/Wall Sconces,,https://lightbulbsurplus.com/incon-21617,https://inconlighting.com/content/specs/216.pdf,"""Order Code=21617-LED"";""Light Source=LED"";""Fixture Style=Modern"";""Base Color=Ultra Chrome"";""Shade/Lens Color=White Translucent"";""Shade/Lens Material=Acrylic"";""Wattage=18 Watts"";""Color Temperature=3000K, 4000K, 5000K"";""Depth (in.)=4.00"""""";""Width (in.)=11.50"""""";""Height (in.)=10.30"""""";""Case Quantity=1"";Dimmable=Yes;Lumens=1,600;""Equivalent=120 Watts"";""Socket Type=E26 Medium Base"";Voltage=120V;""UL Listed=Damp Location Listed"";""Country of Origin=Made in the USA""",0,47531
30391-E26,30391-E26,60W Max Mason Jar White Wall Mount Porch Light,Incon Lighting,"<h2 class=""short_description"">60 Watt Ribbed Lens Outdoor Fixture - Impact Resistant Polycarbonate Light Housing</h2> <div class=""description""> <p>Incon Lighting's 303 series are well-built outdoor fixtures for wet locations, ideal for residential, commercial, and industrial use. The 30391-INC does not include a bulb; it has a 60 watt maximum E26 socket. It has a clear ribbed acrylic jar lens.</p> </div>",Fixtures/Outdoor/Wall Mount,,https://lightbulbsurplus.com/products/60w-max-mason-jar-white-wall-mount-porch-light.html,,"""Fixture Style=Contemporary"";""Lighting Technology=LED Ready"";""__Fixture Finish=White"";""__Wattage Range=60-69"";""Shade/Lens Color=Clear"";""Shade/Lens Material=Acrylic"";""Base Color=White"";""Depth (in.)=5.875"";""Width (in.)=4.5"";""Height (in.)=7.25"";""Case Quantity=1"";""Country of Origin=Made in the USA"";""Order Code=30391-INC-NL"";""Socket Type=E26 Medium"";""UL Listed=Wet Location Listed"";Voltage=120V;""Wattage=60 Watts"";""Light Source=Incandescent""",0,47594
85565-E26,85565-E26,Black Large Outdoor Coach Lantern Post Top Light Fixture,Incon Lighting,"<h2 class=""short_description""><strong>Composite Exterior Area Pole Mount Lamp Fixture |&nbsp;</strong><strong>Incandescent or LED Ready | E26 Medium Socket&nbsp;</strong></h2> <div class=""description""> <p>Transform your outdoor space with the perfect blend of sophistication and functionality found in the Black Large Outdoor Coach Lantern Post Top Light Fixture. This beautifully crafted fixture is designed to provide ample lighting for your pathways, driveways, and other outdoor areas while enhancing the aesthetic appeal of your property.</p> <h4><strong>Product Highlights</strong></h4> <ul> <li>Timeless lantern-style design for a classic touch</li> <li>Sturdy construction ensures lasting performance</li> <li>Weatherproof composite materials for dependable outdoor use</li> <li>Ideal for brightening pathways, driveways, and gardens</li> <li>Simple installation and low-maintenance design</li> <li>Buy American Act Compliant (BAA)</li> </ul> <h4><strong>Timeless Lantern-Style Design</strong></h4> <p>The Black outdoor Lamp Post Lantern features a timeless lantern-style design that adds a classic touch to any outdoor space. Its intricate detailing and elegant black finish create a refined and ageless look that complements various architectural styles.</p> <h4><strong>Sturdy Construction </strong></h4> <p>Constructed from high-quality, heavy duty composite materials, this outdoor lamp post fixture is designed to withstand the test of time. Its sturdy construction ensures long-lasting performance, making it an ideal choice for exterior lighting applications.</p> <h4><strong>Weatherproof Materials </strong></h4> <p>The Black Exterior Lamp Post Lantern is specifically designed for outdoor use, featuring weatherproof materials that can handle various weather conditions. This reliable fixture will maintain its appearance and performance, ensuring that your outdoor space remains well-lit and inviting.</p> <h4><strong>Versatile Exterior Lighting Solution</strong></h4> <p>This lamp post fixture is perfect for brightening walkways, driveways, gardens, and other outdoor areas. Its versatile design allows it to blend seamlessly with various architectural styles, making it an excellent addition to any property.</p> <h4><strong>Simple Installation and Low-Maintenance Design </strong></h4> <p>The Black Exterior Lamp Post Lantern is designed for easy installation, allowing you to upgrade your outdoor lighting with minimal effort. Its low-maintenance construction ensures that you can enjoy years of reliable and elegant illumination without the need for constant upkeep.</p> <h4><strong>Buy American Act Compliant (BAA) - Supporting Local Manufacturing</strong></h4> <p><span>This Large Post Top Coach Lantern is proudly Buy American Act Compliant (BAA), ensuring that it meets strict standards for local manufacturing and supports the American economy. By choosing this outdoor lighting fixture, you are not only enhancing the beauty and functionality of your outdoor space but also contributing to the growth and sustainability of local industries. The BAA compliance ensures that the materials and labor used in the production of this elegant fixture are sourced from the United States, promoting job creation and strengthening the national economy. Make a conscious choice for your outdoor lighting needs with the Black Exterior Lamp Post Top Lantern, and support American manufacturing while enjoying a high-quality, stylish product.</span></p> <p><span>Illuminate Your Outdoor Space with the Black Exterior Lamp Post Lantern</span> Add timeless elegance and functionality to your outdoor space with the Black Exterior Lamp Post Lantern. Browse our selection at Light Bulb Surplus and transform your outdoor lighting experience today.</p> <h4><strong>Options</strong></h4> <ul> <li>Add 9W LED Medium Base Bulb (800 lumens)</li> </ul> </div> <h4><strong>Downloads</strong></h4> <div class=""collateral-box attachment-specs""><span class=""label""><span class=""attach-img""><a class=""prod-attach"" title=""855 Spec"" href=""https://inconlighting.com/content/specs/855.pdf"" target=""_blank""><img class=""__mce_add_custom__"" style=""margin-right: 5px;"" title=""spec-100px.png"" src=""https://cdn11.bigcommerce.com/s-o7p3kkw0ib/product_images/uploaded_images/spec-100px.png"" alt=""spec-100px.png"" width=""100"" height=""100"" /></a></span></span><strong style=""font-size: 1em;""><em><a href=""https://inconlighting.com/content/specs/854-855-instruction.pdf"" target=""_blank""><img class=""__mce_add_custom__"" title=""lbs-download-install-100px.png"" src=""https://cdn11.bigcommerce.com/s-o7p3kkw0ib/product_images/uploaded_images/lbs-download-install-100px.png"" alt=""lbs-download-install-100px.png"" width=""100"" height=""100"" /></a></em></strong></div> <div class=""collateral-box attachment-specs""> <h4><strong>Disclaimers</strong></h4> <p><em>*This product typically ships in 2 to 3 business days. Larger quantities may take longer than stated lead-time.&nbsp; All lead-times are estimates and you will be notified by email if it will take longer than 3 business days to ship. This item ships directly from the factory.</em></p> <p>&nbsp;</p> </div>",Fixtures/Outdoor/Street Lights | Post Mount/Coach Post Lanterns,720043488282,https://lightbulbsurplus.com/black-large-outdoor-coach-lantern-post-top-light-fixture/,https://inconlighting.com/content/specs/855.pdf,"""Order Code=85565-E26"";""Fixture Type=Post Top"";""Fixture Style=Classic"";""Fixture Finish=Black"";""Fixture Shape=Lantern"";""Fixture Environment=Outdoor"";""Fixture Application=Area, General"";""Base Material=Polycarbonate"";""Shade/Lens Color=Frosted"";""Shade/Lens Material=Acrylic"";""Light Source=Incandescent or LED Ready (Bulb Not Included)"";""Lamp(s) Included=Sold Separately"";""Socket Type=E26 Medium"";""Wattage=100 Watt Max (Bulb Not Included)"";""UL Listed=Wet Location Listed"";""Warranty=3 Year"";""Country of Origin=Made in the USA"";""Short Description=Typically Ships in 2-3 Business Days""",0,47627
30395-13LED-120-40K,30395-13LED-120-40K,LED Mason Jar Black Wall Mount 13W Porch Light 4000K,Incon Lighting,"<h2 class=""short_description"">13 Watt Ribbed Lens Outdoor Fixture 60 Watt Equal - Impact Resistant Polycarbonate Light Housing - Optional Dusk-to-Dawn Photocell</h2> <div class=""description""> <p>Incon Lighting's 303 series are well-built outdoor fixtures for wet locations, ideal for residential, commercial, and industrial use. The 30395-13LED-120 includes a 13 watt (60W equivalent) LED bulb that emits 900 lumens of cool white light. It has a clear ribbed acrylic jar lens and can be fitted with a dusk-to-dawn photocell.</p> </div> <h4>Downloads</h4> <div class=""collateral-box attachment-specs""> <ul id=""product-attachment-specs-table"" class=""data-table""> <li><span class=""label""> <a class=""prod-attach"" title=""303 LED Series"" href=""https://lightbulbsurplus.com/content/file-1482338993.pdf""> <span class=""attach-img""><img style=""margin-right: 5px;"" src=""https://cdn11.bigcommerce.com/s-o7p3kkw0ib/product_images/uploaded_images/pdf.png"" alt=""View File"" /></span> </a> </span> <p>303 Series Specifications</p> </li> </ul> </div>",Fixtures/Outdoor/Wall Mount,,https://lightbulbsurplus.com/products/led-mason-jar-black-wall-mount-13w-porch-light-4000k.html,,"""Fixture Style=Contemporary"";""Shade/Lens Color=Clear"";""Shade/Lens Material=Acrylic"";""Base Color=Black"";""Depth (in.)=5.875"";""Width (in.)=4.5"";""Height (in.)=7.25"";""Case Quantity=1"";""Color Temperature=4000K"";""Country of Origin=Made in the USA"";Dimmable=Yes;""Lumens=900 Lumens"";""Order Code=30395-13LED-120-40K"";""Equivalent=60 Watts"";""UL Listed=Wet Location Listed"";Voltage=120V;""Wattage=13 Watts"";""Bulb Color=Cool White"";""Light Source=LED"";""Lighting Technology=Bulbs Included"";""__Lumen Range=500-999"";""__Wattage Range=10-19"";""__Fixture Finish=Black""",0,47749
1815LX1-14LED-120-40K,1815LX1-14LED-120-40K,14W LED White Housing Clear Prismatic Polycarbonate Lens Utility Light 4000K 1,Incon Lighting,"<h2 class=""short_description"">90 Watt Equivalent Cool White - Damp Location Ceiling or Wall Mount Outdoor Light Fixture - Made in the USA</h2> <div class=""description""> <p>Incon Lighting's 181 series is an outdoor ceiling or wall mount light fixture that is UL damp location listed, making it ideal for just about any application at your business or residential. The 1819LX1-14LED-120 includes a 14 watt (90W equivalent) LED unit that emits 1350 lumens of cool white light, and it is made in the USA. It has an impact resistant white powdercoated aluminum pan housing with a clear prismatic polycarbonate lens.</p> </div> <h4>Downloads</h4> <div class=""collateral-box attachment-specs""> <ul id=""product-attachment-specs-table"" class=""data-table""> <li><span class=""label""> <a class=""prod-attach"" title=""181 LED Series"" href=""https://lightbulbsurplus.com/content/file-1506536803.pdf""> <span class=""attach-img""><img style=""margin-right: 5px;"" src=""https://cdn11.bigcommerce.com/s-o7p3kkw0ib/product_images/uploaded_images/pdf.png"" alt=""View File"" /></span> </a> </span> <p>181 Series Specifications</p> </li> </ul> </div>",Fixtures/Indoor/Flush Mount,,https://lightbulbsurplus.com/products/14w-led-white-housing-clear-prismatic-polycarbonate-lens-utility-light-4000k-1.html,,"""Fixture Style=Economy"";""Shade/Lens Color=Clear Prismatic"";""Shade/Lens Material=Polycarbonate"";""Base Color=White"";""Depth (in.)=4.125"";""Width (in.)=10.75"";""Height (in.)=10.75"";""Case Quantity=1"";""Color Temperature=4000K"";""Country of Origin=Made in the USA"";Dimmable=Yes;""Lumens=1350 Lumens"";""Order Code=1819LX1-14LED-120-40K"";""Equivalent=90 Watts"";""UL Listed=Damp Location Listed"";Voltage=120V;""Wattage=14 Watts"";""Bulb Color=Cool White"";""Light Source=LED""",0,47768
